일자,일자,제목
20210101,,"[책마을] 기업 개인 ""포스트 코로나 준비하자"" 투자 전략 담은 도서 인기 이어질 것中 '통신 빅3' 뉴욕증시서 퇴출된다480만원 '미니'로 테슬라 꺾은 中 전기차이성희 농협중앙회장 ""농축산물 제값에 팔고사는 유통개혁 집중""보험 비교 판매 핀테크 업체에도 '방카슈랑스 25% 룰' 적용 논란코로나도 못 막은 우주 덕후들의 열정 ""첫 민간 로켓 카운트다운""막혔던 신용대출 재개 자영업자 '숨통' 트이나세계 40여곳이 '소형 발사체' 경쟁 머스크는 100번째 로켓발사 성공'입주 임박' 목동아델리체, 전세 매물 20개뿐아이오닉5 기아 CV '신기술 풀충전' 차세대 전기차 쏟아진다나이 지역 가리지 않고 ""새해에도 집값 오른다""부평 청천동 '대단지' 분양대결작년 매출 신기록 쓴 카카오 엔씨 ""올해 더 좋다""HUG, 경기 양주 분양가관리지역 지정코스피 기업 시총, GDP 넘어섰다'말레이 1위 정수기' 코웨이, 수출로 위기 탈출'백신 기대감' 올라탄 연성 원자재 면화 설탕 커피값 뛴다롯데케미칼 등 화학株 실적 전망 줄줄이 상향'빅테크 전쟁터' 된 中 전기차 시장파업 위기 넘긴 HMM ""체질개선해 안정적 수익 내자""[특파원 칼럼] 美서 커지는 '현금 살포' 회의론[사설] 성장 수출 일자리, 기저효과만 기대해선 안 된다아프리카 FTA 오늘 공식 출범 ""13억 인구 시장""인도, 아스트라제네카 백신 사용 승인 ""3억명 우선 접종""부동산 또 언급한 유시민 ""불로소득 더 과세해야""마힌드라 ""쌍용차 지분매각 협의 막바지 다음주 텀시트 체결""일반 렌즈 두께의 '1만분의 1' 카툭튀 해결, 성능도 잡았다현대차, 인도서 일냈다 ""역대 12월 중 최다 판매 기록""'자녀 아토피 보장 확정 연금액 평생 지급' 보험사 신상품 경쟁""'우보천리'의 마음으로 힘차게 걸어가겠습니다"" 소띠 인사들의 새해 포부아이폰12, 출시 두 달만에 삼성 5G폰 '연간 판매량' 추월새해 주식투자 전략 '핵심 가설' 지켜보고 '충동베팅' 피해야[클릭! 한경] 코로나 피해 소상공인에 300만원 지원헌법재판소 ""주가조작범에 징역형 벌금형 동시 선고 합헌""OLED TV에 꽂힌 시선 月 출하량 신기록 쓰다아시아나, 새해 첫 운항 반도체 싣고 이륙탄소중립 '묵직한 숙제' '脫원전 재고' 목소리 커져3만弗 앞둔 비트코인, ETF 나오나작년 수출 4분기엔 4.2% 증가했지만 연간으론 5.4% 감소3만달러 넘보는 비트코인 ""조만간 ETF 나올 듯""[단독] '수출 한국'의 힘...1인당 국민소득, 'G7' 伊 제친다美 전문직 주재원 방문교수 비자, 3개월 더 제한한다지난해 수출 -5.4% '선방' ""코로나 전에 워낙 최악이라""[속보] 2020년 연간 수출 5.4%↓ 12월은 12.6%↑모든 위기가 코로나 탓? 기업 자영업자는 전부터 힘들었다“나혼자 산다” 소형 열풍에 ‘하남시청역 해링턴 타워 더센트럴’ 관심개미가 살린 '코스피' 산타랠리에 시총, GDP 훌쩍모더나 ""한국에 코로나 백신 5월부터 공급""화이자 백신, WHO '긴급 사용' 승인 받아2020 뉴욕증시, 최고치 마감 '다우 S&P' 천장 뚫었다바이든 시대 그린株가 뜬다 친환경 신재생에너지 담아라[2021 유망주]SK바이오팜發 활황 맞은 공모주 대어급 줄줄이 대기[2021 유망주]이재갑 장관 ""직접일자리 104만개 중 80% 1분기 내 채용""잠그고 또 잠근다 세계의 주방 꽉 잡은 '밀폐용기 대명사'김현수 장관 ""탄소중립 시대, 농사 방식 완전히 바꿔야""""백화점 직원이 고객용 화장실 쓴 게 죽을 죄인가요""일본차 점유율 3분의 2 '증발' 닛산 인피니티 퇴출금융감독당국 수장들의 새해 화두는 은성수 ""中企 정책금융 확대하겠다""""'액정 파손' LG V50 V40, 최신 폰 LG 윙으로 교체해준다""코로나가 할퀸 자영업자 월세 못내 임대료 분쟁 2배 늘었다美 뉴욕증시, 중국 3대통신사 퇴출 절차 돌입 ""이르면 7일 거래정지""은행, 새해 신용대출 창구 연다 고소득 대출은 여전히 제한'NO 재팬' 현재진행형 유니클로 명동 최대 매장 문 닫는다[속보] 충남 천안 자동차 부품회사 관련 누적 확진자 12명올해 환율 '上低下高' 전망 ""年평균 1100~1125원 될 것""면화 40년만에 가장 긴 상승랠리 설탕 커피도 상승세 [원자재포커스]중국 전기차 4개월 연속 1위 '훙광미니' 중국 토종 브랜드에 쫓기는 테슬라조선내화, 업계 최초 품질검사에 AI 도입 중기부 KAMP 첫 성과코로나 3차유행에 12월 소상공인 전통시장 체감경기 9개월來 최악[마켓인사이트]계속되는 '코로나 변수' 국내 신평사가 보는 신축년 전망은美 포드, 인도 마힌드라와 합작사업 전격 취소 ""코로나19 여파""반도체 장비기업 ASML홀딩 급등 지금 매수해도 괜찮을까'재택근무의 역설' 작년 美 근로자 휴가 덜 쓰고 더 오래 일했다빅테크 대리전 된 중국 전기차 스타트업 경쟁이재갑 고용노동부 장관 ""104만개 직접일자리의 80%, 1분기에 채용"""
20210102,,"서울 유명 중식당 하림각 영업 중단 ""운영할수록 적자""세계 3대 차 부품업체는 왜 LG전자에 5000억을 투자했나 [황정수의 반도체 이슈 짚어보기]""멍멍이 수술비가 사람 못지 않네"" 펫보험 가입하는 집사들바이든 당선에 활짝 웃은 청정에너지 ETF 편입종목 살펴보니비트코인 '3만 달러' 돌파 사상최고가 또 경신[희망 2021 핀테크 본격화] 신한은행 앱에서 배달음식 주문 토스뱅크, 7월부터 영업 시작식약처, 코로나19 백신별 전담반 구성 ""품목 허가 40일 이내로""셀트리온 떠난 '65세 청년' 서정진, 혈액 검사 스타트업 차린다[속보] 코로나19 신규확진 824명 신년연휴 영향한국, G20 중 증시 시총 증가율 2위 중국이 1위코로나 승자는 美 부호들 일론 머스크 재산 5배로 뛰어지만수 박사 ""코로나의 가장 큰 수혜 국가는 중국"" [노경목의 미래노트]마힌드라 ""쌍용차 지분 매각 마무리 단계""미 항공사들, 지난해 코로나 팬데믹에 손실 38조 '악몽'"
20210103,,"온실가스 줄인 기업, 20곳 중 9곳뿐 韓기업, 환경지표에 '발목'새로 '별'단 은행 부행장들 '57세, IB 영업통'한경-IBS ESG 지표는 어떻게 다를까글로벌 시장 ESG 리스크 ""ESG 강화 안하면 경영진 갈아 치울 것""한경 뉴스레터 '모바일 푸시'로 찾아갑니다경제4단체 ""규제3법, 최소한이라도 보완입법을""""전국민 마스크 해방을 위해"" 확진자와 구급차 동승도 불사빨라지는 ESG 시계 韓기업 '발등의 불'저출산 쇼크 인구 2만838명 줄어, '1인 가구' 900만 전체의 40% 육박아파트 매매 전세價 ""하락할 것"" 고작 4%日 기업인들 ""올 성장률 3% 밑돌 것""""텅 빈 헬스장만 닦을 수 없어 PT영상 만들죠""""국내 기업의 ESG 경영 한경이 돕겠습니다""""출구 꽉 막은 징벌적 세금정책이 가장 큰 문제""너무 비싼 美 불임치료 그 틈새 파고든 보험사 프로지니글로벌 '폐기물 대란' 속 웃었다 美 업계 1위 웨이스트매니지먼트""소형 혁신기업 ETF 뜬다"" ARKK 등 투자 추천""차익 실현이냐"" vs ""비중 확대냐"" 새해 고민 깊어진 개미들마루 만드는 동화기업, 전기차 소재 '숨은 진주'작년 개인 순매수 3위 'ETF 곱버스' 4일부터 문턱 높아진다새해 빛날 부동산 돌고돌아 다시 '강남 마용성'우리은행, 거점점포 중심 영업 나선다이번주 판교밸리자이 등 2703가구 청약접수소상공인 특고 3차 재난지원금 6일 공고 11일부터 지급상하이증시, 中 제조업 경기확장 8개월 연속 이어갈까청년에게 1200만원 주는 '청년내일채움공제' 신청하세요비트코인 3만3000달러 돌파 한국에선 더 비싼 3700만원[월요전망대] 외환보유액 11년새 최대 증가 '적정 규모' 논란 커질 듯[사설] 쏟아지는 '집값 상승' 전망 탁상공론 대책으론 안 된다[사설] '인구 감소' 닥쳤는데 연금 복지제도 이대로 둘 건가[경제포커스] 부유세와 자본이탈의 그림자[기고] 금융결제원은 중앙은행의 분신이 아니다[시론] 정부가 기업가치 높여주는 방법테슬라, 작년 전기차 50만대 팔았다오후 6시까지 서울 코로나19 신규 확진자 153명으로 감소이갑종 오리엔트골프 회장 ""야마하 클럽, 업계 첫 환불보증제 도입할 것""한남대 한양대 이어 강원대에도 첨단산업단지 조성서울 강변역~남양주 '간선급행버스' 달린다올 1학기 대학 학자금 대출금리 年 1.7%롯데케미칼 ""산업재해 발생 땐 성과 인정 안해""기아차 K시리즈 판매 '역대최다' K5, 전년보다 두 배 넘게 팔려현대 기아차 AS부품 300만종, AI로 관리 '모비스 맵스' 뜬다빅테크發 금융 빅뱅에 은행 '순혈주의' 약해지고 외부영입 박차비트코인 3만5000弗 근접 한국선 더 비싼 3945만원[기고] 금융결제원은 중앙은행의 분신이 아니다놓칠 뻔한 카드 혜택, 핀테크 앱에서 한눈에글로벌 기관 평가기준 '들쭉날쭉' 오뚜기 점수는? MSCI는 'A' 톰슨로이터 'C'잠실 마포 2주택 종부세, 단독명의 986만원<공동명의 2300만원규제지역서 내집 마련하려는 청년들 일단 이것부터 해두자 [정연일의 청약ABC]'땡큐 차이나' 테슬라, 지난해 판매량 50만대 육박1학기 대학 학자금 대출 1.7% 지난 2학기보다 0.15%p 낮춰1년 전보다 가격 오른 약품 50% 많아져 평균 인상률 3.3%""백신 불균등한 회복 중국"" 올해 세계 경제 7대 이슈는1년 전 예언 적중했던 전문가 ""올해 비트코인 1억 넘는다""수원 당수2지구 제로에너지 특화도시로 조성 에너지 자립률 50%3기 신도시 3만가구 쏟아진다 7월 사전청약 시작배당 소득이 따박따박 은퇴자들에게 추천하는 美 ETF 3종인도 마힌드라 ""내달 28일까지 쌍용차 지분 매각""현대모비스, 전세계 6500만여대 車부품 실시간으로 관리한다""테슬라를 무너뜨릴 수 있는 스타트업이 뜨고 있다""[속보] 코로나 657명 확진, 이틀째 1000명 아래 연휴 영향소상공인 특고 재난지원금, 오는 11일부터 지급한다현대모비스, 새해부터 '신기술 집약' 맵스로 부품 공급 관리한다비트코인 3만3000달러 돌파 ""진짜 40만달러 가나""축포 터트린 코스피 새해도 랠리 이어갈까 [주간전망]'세컨카' 고민이라면 가격 주행거리 다잡은 '푸조 e-208'[신차털기]자율항해선박부터 방역로봇까지 미리보는 CES 2021 [노정동의 3분IT]급성장하는 클린에너지, 장기 분산 투자를계란 닭 오리 가격 다 뛰는데 정부 ""안정적인 상황""올해 60개 품목에 할당관세 4000억원 지원 효과삼성디스플레이, 노트북용 OLED 파이 키운다 ""판매량 5배 증가""회계입문서 펴낸 위성백 예보 사장 ""회계! 내가 좀 알려줘?""소송 화해비용도 양도세 계산 때 필요경비로 인정우리은행, 거점 점포 중심 영업 체계 'VG' 선보인다""냥이 수술비가 사람 못지 않네"" 펫보험 가입하는 집사들신길뉴타운 전용 84㎡ 집값 줄줄이 15억 돌파세대주만 1순위 청약 자격 따로 산다면 '세대 분리'부터""옐런은 反가상화폐로 유명"" 美, 비트코인 규제 나서나""美 집단면역 시점 예상보다 더뎌 하반기까진 경제 회복 쉽지 않아""""美 中, 결국 유화책 모색할 것 올해도 ESG투자 여전히 유망""사업 아이디어 훔치면 최대 3배 배상해야엄태관 오스템임플란트 대표 ""투명 치아교정 제품 연내 中진출""가평 아산 강릉 청약 대출 규제 덜한 아파트 2만3000가구 나온다극동유화 신임사장 장선우조선내화, AI기술로 벽돌 불량률 '뚝'정지선 ""고객의 본원적 가치 찾자""인도, 아스트라제네카 자국 기업 코로나백신 긴급사용 승인편의점 5만개 시대 장보기 세탁 택배 '多되네'조류독감 확산에 닭 계란 오리 가격 껑충서정민 브랜디 대표 ""알리바바도 러브콜 동대문패션 세계화 이끌 것""삼성맨 영입한 농협 은행권 '순혈주의' 깨지나원격전기검침 시장 90% 장악한 누리텔레콤기업은행, 미얀마에 현지법인 세운다 ""中企금융 선도할 것"""
